✅ Ether / Dot1Q / IPv6 / TCP 2600:1900:4110:86f:::http > 2401:4900:63fe:9227:f1bd:8a0f:97da:c687:45908 PA / Raw
✅ Ether / Dot1Q / IPv6 / TCP 2600:1900:4110:86f:::http > 2401:4900:63fe:9227:f1bd:8a0f:97da:c687:45908 A / Raw
✅ Ether / Dot1Q / IPv6 / TCP 2600:1900:4110:86f:::http > 2401:4900:63fe:9227:f1bd:8a0f:97da:c687:45908 PA / Raw
✅ Ether / Dot1Q / IPv6 / TCP 2600:1900:4110:86f:::http > 2401:4900:63fe:9227:f1bd:8a0f:97da:c687:45908 A / Raw
✅ Ether / IPv6 / TCP 2401:4900:63fe:9227:f1bd:8a0f:97da:c687:45908 > 2600:1900:4110:86f:::http A
✅ Ether / IPv6 / TCP 2401:4900:63fe:9227:f1bd:8a0f:97da:c687:45908 > 2600:1900:4110:86f:::http A
✅ Ether / Dot1Q / IPv6 / TCP 2600:1900:4110:86f:::http > 2401:4900:63fe:9227:f1bd:8a0f:97da:c687:45908 PA / Raw
✅ Ether / Dot1Q / IPv6 / TCP 2600:1900:4110:86f:::http > 2401:4900:63fe:9227:f1bd:8a0f:97da:c687:45908 A / Raw
✅ Ether / Dot1Q / IPv6 / TCP 2600:1900:4110:86f:::http > 2401:4900:63fe:9227:f1bd:8a0f:97da:c687:45908 PA / Raw
✅ Ether / Dot1Q / IPv6 / TCP 2600:1900:4110:86f:::http > 2401:4900:63fe:9227:f1bd:8a0f:97da:c687:45908 A / Raw
✅ Ether / IPv6 / TCP 2401:4900:63fe:9227:f1bd:8a0f:97da:c687:45908 > 2600:1900:4110:86f:::http A
✅ Ether / IP / TCP 23.61.112.44:https > 192.168.174.12:46122 SA
✅ Ether / IPv6 / TCP 2401:4900:63fe:9227:f1bd:8a0f:97da:c687:45908 > 2600:1900:4110:86f:::http A
✅ Ether / IP / TCP 192.168.174.12:46122 > 23.61.112.44:https A
✅ Ether / Dot1Q / IPv6 / TCP 2600:1900:4110:86f:::http > 2401:4900:63fe:9227:f1bd:8a0f:97da:c687:45908 PA / Raw
✅ Ether / IPv6 / TCP 2401:4900:63fe:9227:f1bd:8a0f:97da:c687:45908 > 2600:1900:4110:86f:::http A
✅ Ether / Dot1Q / IPv6 / TCP 2600:1900:4110:86f:::http > 2401:4900:63fe:9227:f1bd:8a0f:97da:c687:45908 A / Raw
✅ Ether / Dot1Q / IPv6 / TCP 2600:1900:4110:86f:::http > 2401:4900:63fe:9227:f1bd:8a0f:97da:c687:45908 PA / Raw
✅ Ether / Dot1Q / IPv6 / TCP 2600:1900:4110:86f:::http > 2401:4900:63fe:9227:f1bd:8a0f:97da:c687:45908 A / Raw
✅ Ether / Dot1Q / IPv6 / TCP 2600:1900:4110:86f:::http > 2401:4900:63fe:9227:f1bd:8a0f:97da:c687:45908 PA / Raw
✅ Ether / IPv6 / TCP 2401:4900:63fe:9227:f1bd:8a0f:97da:c687:45908 > 2600:1900:4110:86f:::http A
✅ Ether / IPv6 / TCP 2401:4900:63fe:9227:f1bd:8a0f:97da:c687:45908 > 2600:1900:4110:86f:::http A
✅ Ether / Dot1Q / IPv6 / TCP 2600:1900:4110:86f:::http > 2401:4900:63fe:9227:f1bd:8a0f:97da:c687:45908 A / Raw
✅ Ether / IP / TCP 192.168.174.12:45880 > 104.18.32.47:https PA / Raw
✅ Ether / Dot1Q / IP / TCP 13.107.137.11:https > 192.168.174.12:45910 A
✅ Ether / Dot1Q / IPv6 / TCP 2600:1900:4110:86f:::http > 2401:4900:63fe:9227:f1bd:8a0f:97da:c687:45908 PA / Raw
✅ Ether / Dot1Q / IPv6 / TCP 2600:1900:4110:86f:::http > 2401:4900:63fe:9227:f1bd:8a0f:97da:c687:45908 A / Raw
✅ Ether / Dot1Q / IPv6 / TCP 2600:1900:4110:86f:::http > 2401:4900:63fe:9227:f1bd:8a0f:97da:c687:45908 PA / Raw
✅ Ether / Dot1Q / IPv6 / TCP 2600:1900:4110:86f:::http > 2401:4900:63fe:9227:f1bd:8a0f:97da:c687:45908 A / Raw
✅ Ether / IP / TCP 192.168.174.12:45910 > 13.107.137.11:https A / Raw
✅ Ether / IP / TCP 192.168.174.12:45910 > 13.107.137.11:https A / Raw
✅ Ether / IPv6 / TCP 2401:4900:63fe:9227:f1bd:8a0f:97da:c687:45908 > 2600:1900:4110:86f:::http A
✅ Ether / IPv6 / TCP 2401:4900:63fe:9227:f1bd:8a0f:97da:c687:45908 > 2600:1900:4110:86f:::http A
✅ Ether / Dot1Q / IPv6 / TCP 2600:1900:4110:86f:::http > 2401:4900:63fe:9227:f1bd:8a0f:97da:c687:45908 PA / Raw
✅ Ether / Dot1Q / IPv6 / TCP 2600:1900:4110:86f:::http > 2401:4900:63fe:9227:f1bd:8a0f:97da:c687:45908 A / Raw
✅ Ether / Dot1Q / IPv6 / TCP 2600:1900:4110:86f:::http > 2401:4900:63fe:9227:f1bd:8a0f:97da:c687:45908 PA / Raw
✅ Ether / Dot1Q / IPv6 / TCP 2600:1900:4110:86f:::http > 2401:4900:63fe:9227:f1bd:8a0f:97da:c687:45908 PA / Raw
✅ Ether / IPv6 / TCP 2401:4900:63fe:9227:f1bd:8a0f:97da:c687:45908 > 2600:1900:4110:86f:::http A
✅ Ether / IPv6 / TCP 2401:4900:63fe:9227:f1bd:8a0f:97da:c687:45908 > 2600:1900:4110:86f:::http A
✅ Ether / IPv6 / TCP 2401:4900:63fe:9227:f1bd:8a0f:97da:c687:45908 > 2600:1900:4110:86f:::http PA / Raw
✅ Ether / IP / UDP / DNS Qry b'settings-win.data.microsoft.com.'
✅ Ether / IP / UDP / DNS Qry b'settings-win.data.microsoft.com.'
✅ Ether / Dot1Q / IP / TCP 13.107.137.11:https > 192.168.174.12:45910 A
✅ Ether / IP / TCP 192.168.174.12:45910 > 13.107.137.11:https A / Raw
✅ Ether / Dot1Q / IP / TCP 13.107.137.11:https > 192.168.174.12:45910 A
✅ Ether / IP / TCP 192.168.174.12:45910 > 13.107.137.11:https A / Raw
✅ Ether / IP / TCP 192.168.174.12:45910 > 13.107.137.11:https A / Raw
✅ Ether / Dot1Q / IP / TCP 13.107.137.11:https > 192.168.174.12:45910 A
✅ Ether / IP / TCP 192.168.174.12:45910 > 13.107.137.11:https A / Raw
✅ Ether / Dot1Q / IP / TCP 13.107.137.11:https > 192.168.174.12:45910 A
✅ Ether / IP / TCP 192.168.174.12:45910 > 13.107.137.11:https A / Raw
✅ Ether / IP / TCP 192.168.174.12:45910 > 13.107.137.11:https A / Raw
✅ Ether / Dot1Q / IP / TCP 13.107.137.11:https > 192.168.174.12:45910 A
✅ Ether / IP / TCP 192.168.174.12:45910 > 13.107.137.11:https A / Raw
✅ Ether / IP / TCP 23.61.112.44:https > 192.168.174.12:46089 A
✅ Ether / Dot1Q / IPv6 / TCP 2600:1900:4110:86f:::http > 2401:4900:63fe:9227:f1bd:8a0f:97da:c687:45908 PA / Raw
✅ Ether / IPv6 / TCP 2401:4900:63fe:9227:f1bd:8a0f:97da:c687:45908 > 2600:1900:4110:86f:::http A
✅ Ether / IP / UDP / DNS Qry b'mobile.events.data.microsoft.com.'
✅ Ether / IP / UDP / DNS Qry b'mobile.events.data.microsoft.com.'
✅ Ether / Dot1Q / IP / TCP 13.107.137.11:https > 192.168.174.12:45910 A
✅ Ether / IP / TCP 192.168.174.12:45910 > 13.107.137.11:https A / Raw
✅ Ether / IP / TCP 192.168.174.12:45910 > 13.107.137.11:https A / Raw
✅ Ether / IP / TCP 192.168.174.12:45957 > 13.107.137.11:https A / Raw
✅ Ether / Dot1Q / IP / TCP 13.107.137.11:https > 192.168.174.12:45910 A
❌ Ether / IP / ICMP 192.168.174.12 > 202.39.224.7 echo-request 0 / Raw - Blocked Protocol: ICMP
✅ Ether / IP / TCP 192.168.174.12:45910 > 13.107.137.11:https A / Raw
✅ Ether / Dot1Q / IP / TCP 13.107.137.11:https > 192.168.174.12:45910 A
✅ Ether / IP / TCP 192.168.174.12:45910 > 13.107.137.11:https A / Raw
✅ Ether / IP / TCP 192.168.174.12:45910 > 13.107.137.11:https A / Raw
✅ Ether / Dot1Q / IP / TCP 13.107.137.11:https > 192.168.174.12:45910 A
✅ Ether / IP / TCP 192.168.174.12:45910 > 13.107.137.11:https A / Raw
✅ Ether / IP / UDP / DNS Qry b'ab.chatgpt.com.'
✅ Ether / Dot1Q / IP / TCP 13.107.137.11:https > 192.168.174.12:45910 A
✅ Ether / IP / TCP 192.168.174.12:45910 > 13.107.137.11:https A / Raw
✅ Ether / IP / TCP 192.168.174.12:45910 > 13.107.137.11:https PA / Raw
✅ Ether / IP / TCP 192.168.174.12:45900 > 104.18.32.47:https PA / Raw
✅ Ether / IPv6 / TCP 2401:4900:63fe:9227:f1bd:8a0f:97da:c687:45962 > 2404:6800:4007:808::200e:https A / Raw
✅ Ether / IP / UDP / DNS Qry b'cp601.prod.do.dsp.mp.microsoft.com.'
✅ Ether / IP / UDP / DNS Qry b'cp601.prod.do.dsp.mp.microsoft.com.'
✅ Ether / IP / TCP 23.61.112.44:https > 192.168.174.12:46089 A / Raw
✅ Ether / IP / TCP 23.61.112.44:https > 192.168.174.12:46053 SA
✅ Ether / Dot1Q / IP / TCP 13.107.137.11:https > 192.168.174.12:45910 A
✅ Ether / IP / TCP 192.168.174.12:45910 > 13.107.137.11:https A / Raw
✅ Ether / Dot1Q / IP / TCP 13.107.137.11:https > 192.168.174.12:45910 A
✅ Ether / IP / TCP 192.168.174.12:45910 > 13.107.137.11:https A / Raw
✅ Ether / IP / TCP 192.168.174.12:45910 > 13.107.137.11:https A / Raw
✅ Ether / IP / TCP 52.168.112.66:https > 192.168.174.12:46042 A
✅ Ether / IP / TCP 192.168.174.12:46106 > 23.61.112.44:https PA / Raw
✅ Ether / Dot1Q / IP / TCP 13.107.137.11:https > 192.168.174.12:45910 A
✅ Ether / IP / TCP 192.168.174.12:45910 > 13.107.137.11:https A / Raw
✅ Ether / Dot1Q / IP / TCP 13.107.137.11:https > 192.168.174.12:45910 A
✅ Ether / IP / TCP 192.168.174.12:45910 > 13.107.137.11:https A / Raw
✅ Ether / IP / TCP 192.168.174.12:45910 > 13.107.137.11:https A / Raw
✅ Ether / IP / TCP 23.61.112.44:https > 192.168.174.12:46096 SA
✅ Ether / IP / TCP 23.61.112.44:https > 192.168.174.12:46102 SA
✅ Ether / IP / TCP 192.168.174.12:46096 > 23.61.112.44:https A
✅ Ether / IP / TCP 192.168.174.12:46102 > 23.61.112.44:https A
✅ Ether / Dot1Q / IP / TCP 13.107.137.11:https > 192.168.174.12:45911 A
✅ Ether / IP / TCP 192.168.174.12:45911 > 13.107.137.11:https A / Raw
✅ Ether / IP / TCP 192.168.174.12:45911 > 13.107.137.11:https A / Raw
✅ Ether / Dot1Q / IPv6 / TCP 2600:140f:6::17c7:4580:https > 2401:4900:63fe:9227:f1bd:8a0f:97da:c687:45904 A
✅ Ether / IP / TCP 23.61.112.44:https > 192.168.174.12:46105 SA
✅ Ether / IP / TCP 23.61.112.44:https > 192.168.174.12:46057 SA
✅ Ether / IP / TCP 23.61.112.44:https > 192.168.174.12:46054 SA
✅ Ether / IP / TCP 23.61.112.44:https > 192.168.174.12:46091 A / Raw
✅ Ether / Dot1Q / IPv6 / TCP 2600:140f:6::17c7:4580:https > 2401:4900:63fe:9227:f1bd:8a0f:97da:c687:45904 A / Raw
✅ Ether / Dot1Q / IPv6 / TCP 2600:140f:6::17c7:4580:https > 2401:4900:63fe:9227:f1bd:8a0f:97da:c687:45904 PA / Raw
✅ Ether / IP / TCP 23.61.112.44:https > 192.168.174.12:46100 SA
✅ Ether / IP / TCP 192.168.174.12:46105 > 23.61.112.44:https A
✅ Ether / IP / TCP 192.168.174.12:46100 > 23.61.112.44:https A
✅ Ether / IPv6 / TCP 2401:4900:63fe:9227:f1bd:8a0f:97da:c687:45904 > 2600:140f:6::17c7:4580:https A
✅ Ether / IPv6 / TCP 2401:4900:63fe:9227:f1bd:8a0f:97da:c687:45904 > 2600:140f:6::17c7:4580:https A
✅ Ether / IPv6 / TCP 2401:4900:63fe:9227:f1bd:8a0f:97da:c687:45904 > 2600:140f:6::17c7:4580:https PA / Raw
✅ Ether / IP / TCP 192.168.174.12:46042 > 52.168.112.66:https FPA / Raw
✅ Ether / Dot1Q / IP / TCP 13.107.137.11:https > 192.168.174.12:45910 A
✅ Ether / IP / TCP 192.168.174.12:45910 > 13.107.137.11:https A / Raw
✅ Ether / IP / TCP 23.61.112.44:https > 192.168.174.12:46115 SA
✅ Ether / IP / TCP 192.168.174.12:46115 > 23.61.112.44:https A
✅ Ether / IP / TCP 23.61.112.44:https > 192.168.174.12:46119 SA
✅ Ether / IP / TCP 23.61.112.44:https > 192.168.174.12:46117 SA
✅ Ether / IP / TCP 23.61.112.44:https > 192.168.174.12:46114 SA
✅ Ether / IP / TCP 23.61.112.44:https > 192.168.174.12:46118 SA
✅ Ether / IP / TCP 192.168.174.12:46119 > 23.61.112.44:https A
✅ Ether / IP / TCP 192.168.174.12:46117 > 23.61.112.44:https A
✅ Ether / IP / TCP 192.168.174.12:46114 > 23.61.112.44:https A
✅ Ether / IP / TCP 192.168.174.12:46118 > 23.61.112.44:https A
✅ Ether / IP / TCP 192.168.174.12:46095 > 23.61.112.44:https PA / Raw
✅ Ether / IP / TCP 192.168.174.12:46096 > 23.61.112.44:https PA / Raw
✅ Ether / IP / TCP 192.168.174.12:46098 > 23.61.112.44:https PA / Raw
✅ Ether / Dot1Q / IP / TCP 13.107.137.11:https > 192.168.174.12:45913 A
✅ Ether / IP / TCP 192.168.174.12:45913 > 13.107.137.11:https A / Raw
✅ Ether / IP / TCP 192.168.174.12:46099 > 23.61.112.44:https PA / Raw
✅ Ether / IP / TCP 192.168.174.12:46116 > 23.61.112.44:https PA / Raw
✅ Ether / IP / TCP 192.168.174.12:46100 > 23.61.112.44:https PA / Raw
✅ Ether / IP / TCP 192.168.174.12:46101 > 23.61.112.44:https PA / Raw
✅ Ether / IP / TCP 192.168.174.12:46109 > 23.61.112.44:https PA / Raw
✅ Ether / IP / TCP 192.168.174.12:46119 > 23.61.112.44:https PA / Raw
✅ Ether / IP / TCP 192.168.174.12:46104 > 23.61.112.44:https PA / Raw
✅ Ether / IP / TCP 192.168.174.12:46118 > 23.61.112.44:https PA / Raw
✅ Ether / IP / TCP 192.168.174.12:46105 > 23.61.112.44:https PA / Raw
✅ Ether / IP / TCP 192.168.174.12:46117 > 23.61.112.44:https PA / Raw
✅ Ether / IP / TCP 192.168.174.12:46114 > 23.61.112.44:https PA / Raw
✅ Ether / IP / TCP 192.168.174.12:46111 > 23.61.112.44:https PA / Raw
✅ Ether / IP / TCP 192.168.174.12:46103 > 23.61.112.44:https PA / Raw
✅ Ether / IP / TCP 192.168.174.12:46120 > 23.61.112.44:https PA / Raw
✅ Ether / IP / TCP 192.168.174.12:46110 > 23.61.112.44:https PA / Raw
✅ Ether / IP / TCP 192.168.174.12:46112 > 23.61.112.44:https PA / Raw
✅ Ether / IP / TCP 192.168.174.12:46115 > 23.61.112.44:https PA / Raw
✅ Ether / IP / TCP 192.168.174.12:46113 > 23.61.112.44:https PA / Raw
✅ Ether / IP / TCP 192.168.174.12:46097 > 23.61.112.44:https PA / Raw
✅ Ether / IP / TCP 192.168.174.12:46102 > 23.61.112.44:https PA / Raw
✅ Ether / IP / TCP 192.168.174.12:46108 > 23.61.112.44:https PA / Raw
✅ Ether / IP / TCP 192.168.174.12:46107 > 23.61.112.44:https PA / Raw
✅ Ether / IP / UDP / DNS Qry b'mobile.events.data.microsoft.com.'
✅ Ether / IP / UDP / DNS Qry b'mobile.events.data.microsoft.com.'
✅ Ether / Dot1Q / IP / TCP 13.107.137.11:https > 192.168.174.12:45913 A
✅ Ether / IP / TCP 192.168.174.12:46121 > 23.61.112.44:https PA / Raw
✅ Ether / IP / TCP 192.168.174.12:45913 > 13.107.137.11:https A / Raw
✅ Ether / Dot1Q / IP / TCP 13.107.137.11:https > 192.168.174.12:45913 A
✅ Ether / IP / TCP 192.168.174.12:45913 > 13.107.137.11:https A / Raw
✅ Ether / IP / TCP 192.168.174.12:45913 > 13.107.137.11:https A / Raw
✅ Ether / Dot1Q / IP / TCP 13.107.137.11:https > 192.168.174.12:45913 A
✅ Ether / IP / TCP 192.168.174.12:45913 > 13.107.137.11:https A / Raw
✅ Ether / IP / TCP 23.61.112.44:https > 192.168.174.12:46055 SA
✅ Ether / Dot1Q / IP / TCP 13.107.137.11:https > 192.168.174.12:45913 A
✅ Ether / IP / TCP 192.168.174.12:45913 > 13.107.137.11:https A / Raw
✅ Ether / IP / TCP 192.168.174.12:45913 > 13.107.137.11:https A / Raw
✅ Ether / IP / TCP 23.61.112.44:https > 192.168.174.12:46122 SA
✅ Ether / IP / TCP 192.168.174.12:46122 > 23.61.112.44:https A
✅ Ether / IP / TCP 23.61.112.44:https > 192.168.174.12:46127 SA
✅ Ether / IP / TCP 23.61.112.44:https > 192.168.174.12:46126 SA
✅ Ether / IP / TCP 23.61.112.44:https > 192.168.174.12:46125 SA
✅ Ether / IP / TCP 23.61.112.44:https > 192.168.174.12:46124 SA
✅ Ether / Dot1Q / IPv6 / TCP 2600:140f:6::17c7:4580:https > 2401:4900:63fe:9227:f1bd:8a0f:97da:c687:45907 A
✅ Ether / Dot1Q / IPv6 / TCP 2600:140f:6::17c7:4580:https > 2401:4900:63fe:9227:f1bd:8a0f:97da:c687:45907 A / Raw
✅ Ether / IP / TCP 192.168.174.12:46127 > 23.61.112.44:https A
✅ Ether / IP / TCP 192.168.174.12:46126 > 23.61.112.44:https A
✅ Ether / IP / TCP 192.168.174.12:46125 > 23.61.112.44:https A
✅ Ether / IP / TCP 192.168.174.12:46124 > 23.61.112.44:https A
✅ Ether / IPv6 / TCP 2401:4900:63fe:9227:f1bd:8a0f:97da:c687:45907 > 2600:140f:6::17c7:4580:https A
✅ Ether / Dot1Q / IPv6 / TCP 2600:140f:6::17c7:4580:https > 2401:4900:63fe:9227:f1bd:8a0f:97da:c687:45907 PA / Raw
✅ Ether / IPv6 / TCP 2401:4900:63fe:9227:f1bd:8a0f:97da:c687:45907 > 2600:140f:6::17c7:4580:https A
✅ Ether / IPv6 / TCP 2401:4900:63fe:9227:f1bd:8a0f:97da:c687:45907 > 2600:140f:6::17c7:4580:https PA / Raw
✅ Ether / IP / UDP / DNS Qry b'cp601.prod.do.dsp.mp.microsoft.com.'
✅ Ether / IP / UDP / DNS Qry b'cp601.prod.do.dsp.mp.microsoft.com.'
✅ Ether / IP / TCP 192.168.174.12:45738 > 20.69.137.228:https RA
✅ Ether / Dot1Q / IP / TCP 13.107.137.11:https > 192.168.174.12:45912 A
✅ Ether / IP / TCP 23.61.112.44:https > 192.168.174.12:46136 SA
✅ Ether / IP / TCP 23.61.112.44:https > 192.168.174.12:46133 SA
✅ Ether / IP / TCP 23.61.112.44:https > 192.168.174.12:46130 SA
✅ Ether / IP / TCP 23.61.112.44:https > 192.168.174.12:46128 SA
✅ Ether / IP / TCP 192.168.174.12:46136 > 23.61.112.44:https A
✅ Ether / IP / TCP 192.168.174.12:46133 > 23.61.112.44:https A
✅ Ether / IP / TCP 192.168.174.12:46130 > 23.61.112.44:https A
✅ Ether / IP / TCP 192.168.174.12:46128 > 23.61.112.44:https A
✅ Ether / IP / TCP 23.61.112.44:https > 192.168.174.12:46135 SA
✅ Ether / IP / TCP 192.168.174.12:46135 > 23.61.112.44:https A
✅ Ether / IP / TCP 23.61.112.44:https > 192.168.174.12:46131 SA
✅ Ether / IP / TCP 23.61.112.44:https > 192.168.174.12:46129 SA
✅ Ether / IP / TCP 23.61.112.44:https > 192.168.174.12:46134 SA
✅ Ether / IP / TCP 23.61.112.44:https > 192.168.174.12:46132 SA
✅ Ether / IP / TCP 192.168.174.12:46131 > 23.61.112.44:https A
✅ Ether / IP / TCP 192.168.174.12:46129 > 23.61.112.44:https A
✅ Ether / IP / TCP 192.168.174.12:46134 > 23.61.112.44:https A
✅ Ether / IP / TCP 192.168.174.12:46132 > 23.61.112.44:https A
✅ Ether / Dot1Q / IP / TCP 13.107.137.11:https > 192.168.174.12:45913 A
✅ Ether / IP / TCP 192.168.174.12:45913 > 13.107.137.11:https A / Raw
✅ Ether / IP / UDP / DNS Qry b'settings-win.data.microsoft.com.'
✅ Ether / IP / UDP / DNS Qry b'settings-win.data.microsoft.com.'
✅ Ether / IP / TCP 23.61.112.44:https > 192.168.174.12:46137 A
✅ Ether / IP / TCP 192.168.174.12:46137 > 23.61.112.44:https A
✅ Ether / IP / UDP / DNS Qry b'mobile.events.data.microsoft.com.'
✅ Ether / IP / UDP / DNS Qry b'mobile.events.data.microsoft.com.'
✅ Ether / IP / UDP / DNS Qry b'mobile.events.data.microsoft.com.'
✅ Ether / IPv6 / TCP 2401:4900:63fe:9227:f1bd:8a0f:97da:c687:45908 > 2600:1900:4110:86f:::http PA / Raw
✅ Ether / IP / TCP 23.61.112.44:https > 192.168.174.12:46101 SA
✅ Ether / IP / TCP 23.61.112.44:https > 192.168.174.12:46095 SA
✅ Ether / IP / TCP 192.168.174.12:46101 > 23.61.112.44:https A
✅ Ether / Dot1Q / IP / TCP 13.107.137.11:https > 192.168.174.12:45913 A
✅ Ether / IP / TCP 192.168.174.12:46095 > 23.61.112.44:https A
✅ Ether / IP / TCP 192.168.174.12:45913 > 13.107.137.11:https A / Raw
✅ Ether / IP / TCP 192.168.174.12:45913 > 13.107.137.11:https A / Raw
✅ Ether / IP / TCP 23.61.112.44:https > 192.168.174.12:46103 SA
✅ Ether / IP / TCP 23.61.112.44:https > 192.168.174.12:46104 SA
✅ Ether / IP / TCP 192.168.174.12:46103 > 23.61.112.44:https A
✅ Ether / IP / TCP 192.168.174.12:46104 > 23.61.112.44:https A
✅ Ether / Dot1Q / IP / TCP 13.107.137.11:https > 192.168.174.12:45913 A
✅ Ether / IP / TCP 192.168.174.12:45913 > 13.107.137.11:https A / Raw
✅ Ether / IP / TCP 192.168.174.12:45913 > 13.107.137.11:https PA / Raw
✅ Ether / IP / TCP 23.61.112.44:https > 192.168.174.12:46138 A
✅ Ether / IP / TCP 192.168.174.12:46138 > 23.61.112.44:https R
✅ Ether / IP / TCP 192.168.174.12:46138 > 23.61.112.44:https S
✅ Ether / IP / TCP 23.61.112.44:https > 192.168.174.12:46063 SA
✅ Ether / IP / TCP 23.61.112.44:https > 192.168.174.12:46059 SA
✅ Ether / Dot1Q / IP / TCP 13.107.137.11:https > 192.168.174.12:45913 A
✅ Ether / IP / TCP 192.168.174.12:45913 > 13.107.137.11:https A / Raw
✅ Ether / IP / TCP 23.61.112.44:https > 192.168.174.12:46113 SA
✅ Ether / IP / TCP 192.168.174.12:46113 > 23.61.112.44:https A
✅ Ether / IP / TCP 192.168.174.12:46124 > 23.61.112.44:https PA / Raw
✅ Ether / IP / TCP 192.168.174.12:46125 > 23.61.112.44:https PA / Raw
✅ Ether / IP / TCP 192.168.174.12:46129 > 23.61.112.44:https PA / Raw
✅ Ether / Dot1Q / IP / TCP 13.107.137.11:https > 192.168.174.12:45913 A
✅ Ether / IP / TCP 192.168.174.12:46131 > 23.61.112.44:https PA / Raw
✅ Ether / IP / TCP 192.168.174.12:45913 > 13.107.137.11:https A / Raw
✅ Ether / IP / TCP 192.168.174.12:46128 > 23.61.112.44:https PA / Raw
✅ Ether / IP / TCP 192.168.174.12:46126 > 23.61.112.44:https PA / Raw
✅ Ether / IP / TCP 192.168.174.12:46130 > 23.61.112.44:https PA / Raw
✅ Ether / IP / TCP 192.168.174.12:46127 > 23.61.112.44:https PA / Raw
✅ Ether / IP / TCP 192.168.174.12:46133 > 23.61.112.44:https PA / Raw
✅ Ether / IP / TCP 192.168.174.12:46134 > 23.61.112.44:https PA / Raw
✅ Ether / IP / TCP 192.168.174.12:46132 > 23.61.112.44:https PA / Raw
✅ Ether / Dot1Q / IP / TCP 13.107.137.11:https > 192.168.174.12:45913 A
✅ Ether / IP / TCP 192.168.174.12:45913 > 13.107.137.11:https A / Raw
✅ Ether / IP / TCP 192.168.174.12:45913 > 13.107.137.11:https A / Raw
✅ Ether / IPv6 / TCP 2603:1040:603:c::115:https > 2401:4900:63fe:9227:f1bd:8a0f:97da:c687:45919 PA / Raw
✅ Ether / IPv6 / TCP 2401:4900:63fe:9227:f1bd:8a0f:97da:c687:45919 > 2603:1040:603:c::115:https A / Raw
✅ Ether / IPv6 / TCP 2401:4900:63fe:9227:f1bd:8a0f:97da:c687:45919 > 2603:1040:603:c::115:https PA / Raw
✅ Ether / IP / TCP 192.168.174.12:46135 > 23.61.112.44:https PA / Raw
✅ Ether / IP / TCP 192.168.174.12:46136 > 23.61.112.44:https PA / Raw
✅ Ether / IP / TCP 192.168.174.12:46137 > 23.61.112.44:https PA / Raw
✅ Ether / IP / TCP 23.61.112.44:https > 192.168.174.12:46092 A / Raw
✅ Ether / Dot1Q / IP / TCP 13.107.137.11:https > 192.168.174.12:45913 A
✅ Ether / IP / TCP 192.168.174.12:45913 > 13.107.137.11:https A / Raw
✅ Ether / Dot1Q / IP / TCP 13.107.137.11:https > 192.168.174.12:45913 A
✅ Ether / IP / TCP 192.168.174.12:45913 > 13.107.137.11:https A / Raw
✅ Ether / IP / TCP 192.168.174.12:45913 > 13.107.137.11:https A / Raw
✅ Ether / IP / TCP 192.168.174.12:46122 > 23.61.112.44:https PA / Raw
✅ Ether / Dot1Q / IP / TCP 13.107.137.11:https > 192.168.174.12:45913 A
✅ Ether / IP / TCP 192.168.174.12:45913 > 13.107.137.11:https A / Raw
✅ Ether / Dot1Q / IP / TCP 13.107.137.11:https > 192.168.174.12:45913 A
✅ Ether / IP / TCP 192.168.174.12:45913 > 13.107.137.11:https A / Raw
✅ Ether / IP / TCP 192.168.174.12:45913 > 13.107.137.11:https A / Raw
✅ Ether / IP / UDP / DNS Qry b'ab.chatgpt.com.'
✅ Ether / IP / TCP 23.61.112.44:https > 192.168.174.12:46126 SA
✅ Ether / IP / TCP 23.61.112.44:https > 192.168.174.12:46125 SA
✅ Ether / IP / TCP 192.168.174.12:46126 > 23.61.112.44:https A
✅ Ether / IP / TCP 192.168.174.12:46125 > 23.61.112.44:https A
✅ Ether / IP / TCP 192.168.174.12:46095 > 23.61.112.44:https RA
✅ Ether / IP / TCP 192.168.174.12:46096 > 23.61.112.44:https RA
✅ Ether / IP / TCP 192.168.174.12:46098 > 23.61.112.44:https RA
✅ Ether / IP / TCP 192.168.174.12:46099 > 23.61.112.44:https RA
✅ Ether / IP / TCP 192.168.174.12:46116 > 23.61.112.44:https RA
✅ Ether / IP / TCP 192.168.174.12:46100 > 23.61.112.44:https RA
✅ Ether / IP / TCP 192.168.174.12:46101 > 23.61.112.44:https RA
✅ Ether / IP / TCP 192.168.174.12:46119 > 23.61.112.44:https RA
✅ Ether / IP / TCP 192.168.174.12:46109 > 23.61.112.44:https RA
✅ Ether / IP / TCP 192.168.174.12:46104 > 23.61.112.44:https RA
✅ Ether / IP / TCP 192.168.174.12:46118 > 23.61.112.44:https RA
✅ Ether / IP / TCP 192.168.174.12:46105 > 23.61.112.44:https RA
✅ Ether / IP / TCP 192.168.174.12:46117 > 23.61.112.44:https RA
✅ Ether / IP / TCP 192.168.174.12:46114 > 23.61.112.44:https RA
✅ Ether / IP / TCP 192.168.174.12:46111 > 23.61.112.44:https RA
✅ Ether / IP / TCP 192.168.174.12:46103 > 23.61.112.44:https RA
✅ Ether / IP / TCP 192.168.174.12:46120 > 23.61.112.44:https RA
✅ Ether / IP / TCP 192.168.174.12:46110 > 23.61.112.44:https RA
✅ Ether / Dot1Q / IP / TCP 13.107.137.11:https > 192.168.174.12:45913 A
✅ Ether / IP / TCP 192.168.174.12:46112 > 23.61.112.44:https RA
✅ Ether / IP / TCP 192.168.174.12:46115 > 23.61.112.44:https RA
✅ Ether / IP / TCP 192.168.174.12:46097 > 23.61.112.44:https RA
✅ Ether / IP / TCP 192.168.174.12:46113 > 23.61.112.44:https RA
✅ Ether / IP / TCP 192.168.174.12:46102 > 23.61.112.44:https RA
✅ Ether / IP / TCP 192.168.174.12:46107 > 23.61.112.44:https RA
✅ Ether / IP / TCP 192.168.174.12:46108 > 23.61.112.44:https RA
✅ Ether / IP / TCP 192.168.174.12:46121 > 23.61.112.44:https RA
✅ Ether / IP / TCP 192.168.174.12:46122 > 23.61.112.44:https RA
✅ Ether / IP / TCP 192.168.174.12:46123 > 23.61.112.44:https RA
✅ Ether / IP / TCP 192.168.174.12:46106 > 23.61.112.44:https RA
✅ Ether / IP / TCP 192.168.174.12:45913 > 13.107.137.11:https A / Raw
✅ Ether / IP / UDP / DNS Qry b'cp601.prod.do.dsp.mp.microsoft.com.'
✅ Ether / IP / UDP / DNS Qry b'cp601.prod.do.dsp.mp.microsoft.com.'
✅ Ether / IP / TCP 23.61.112.44:https > 192.168.174.12:46130 SA
✅ Ether / IP / TCP 192.168.174.12:46130 > 23.61.112.44:https A
✅ Ether / IPv6 / TCP 2603:1040:603:c::115:https > 2401:4900:63fe:9227:f1bd:8a0f:97da:c687:45919 PA / Raw
✅ Ether / IP / TCP 23.61.112.44:https > 192.168.174.12:46095 A
✅ Ether / IP / TCP 23.61.112.44:https > 192.168.174.12:46134 SA
✅ Ether / IP / TCP 23.61.112.44:https > 192.168.174.12:46133 SA
✅ Ether / IP / TCP 23.61.112.44:https > 192.168.174.12:46131 SA
✅ Ether / IP / TCP 23.61.112.44:https > 192.168.174.12:46135 SA
✅ Ether / IP / TCP 23.61.112.44:https > 192.168.174.12:46098 A
✅ Ether / IP / TCP 23.61.112.44:https > 192.168.174.12:46105 A
✅ Ether / IP / TCP 23.61.112.44:https > 192.168.174.12:46114 A
✅ Ether / IP / TCP 23.61.112.44:https > 192.168.174.12:46118 A
✅ Ether / IP / TCP 23.61.112.44:https > 192.168.174.12:46112 A
✅ Ether / IP / TCP 23.61.112.44:https > 192.168.174.12:46116 A
✅ Ether / IP / TCP 23.61.112.44:https > 192.168.174.12:46132 SA
✅ Ether / IP / TCP 23.61.112.44:https > 192.168.174.12:46117 A
✅ Ether / IP / TCP 23.61.112.44:https > 192.168.174.12:46115 A
✅ Ether / IP / TCP 23.61.112.44:https > 192.168.174.12:46099 A
✅ Ether / IP / TCP 23.61.112.44:https > 192.168.174.12:46096 A
✅ Ether / IP / TCP 23.61.112.44:https > 192.168.174.12:46119 A
✅ Ether / IP / TCP 192.168.174.12:46134 > 23.61.112.44:https A
✅ Ether / IP / TCP 192.168.174.12:46133 > 23.61.112.44:https A
✅ Ether / IP / TCP 192.168.174.12:46131 > 23.61.112.44:https A
✅ Ether / IP / TCP 192.168.174.12:46135 > 23.61.112.44:https A
✅ Ether / IP / TCP 192.168.174.12:46132 > 23.61.112.44:https A
✅ Ether / IPv6 / TCP 2401:4900:63fe:9227:f1bd:8a0f:97da:c687:45919 > 2603:1040:603:c::115:https A
✅ Ether / Dot1Q / IP / TCP 13.107.137.11:https > 192.168.174.12:45913 A
✅ Ether / IP / TCP 192.168.174.12:45913 > 13.107.137.11:https A / Raw
✅ Ether / IP / TCP 192.168.174.12:45913 > 13.107.137.11:https A / Raw
✅ Ether / IP / TCP 23.61.112.44:https > 192.168.174.12:46103 A
✅ Ether / IP / TCP 23.61.112.44:https > 192.168.174.12:46100 A
✅ Ether / IP / TCP 23.61.112.44:https > 192.168.174.12:46120 A
✅ Ether / IP / TCP 23.61.112.44:https > 192.168.174.12:46101 A
✅ Ether / IP / TCP 23.61.112.44:https > 192.168.174.12:46102 A
✅ Ether / IP / TCP 23.61.112.44:https > 192.168.174.12:46104 A
✅ Ether / IP / TCP 23.61.112.44:https > 192.168.174.12:46122 A
✅ Ether / IP / TCP 23.61.112.44:https > 192.168.174.12:46109 A
✅ Ether / IP / TCP 23.61.112.44:https > 192.168.174.12:46121 A
✅ Ether / IP / TCP 23.61.112.44:https > 192.168.174.12:46108 A
✅ Ether / IP / TCP 23.61.112.44:https > 192.168.174.12:46097 A
✅ Ether / IP / TCP 23.61.112.44:https > 192.168.174.12:46111 A
✅ Ether / IP / TCP 23.61.112.44:https > 192.168.174.12:46113 A
✅ Ether / IP / TCP 23.61.112.44:https > 192.168.174.12:46107 A
✅ Ether / IP / TCP 23.61.112.44:https > 192.168.174.12:46110 A
✅ Ether / IP / TCP 23.61.112.44:https > 192.168.174.12:46106 A
✅ Ether / Dot1Q / IP / TCP 13.107.137.11:https > 192.168.174.12:45913 A
✅ Ether / IP / TCP 192.168.174.12:45913 > 13.107.137.11:https A / Raw
✅ Ether / IP / UDP / DNS Ans b'mobile.events.data.trafficmanager.net.'
✅ Ether / IP / UDP / DNS Ans b'mobile.events.data.trafficmanager.net.'
✅ Ether / Dot1Q / IP / TCP 13.107.137.11:https > 192.168.174.12:45913 A
✅ Ether / IP / TCP 192.168.174.12:45913 > 13.107.137.11:https A / Raw
✅ Ether / IP / TCP 192.168.174.12:45913 > 13.107.137.11:https A / Raw
✅ Ether / Dot1Q / IP / TCP 13.107.137.11:https > 192.168.174.12:45913 A
✅ Ether / IP / TCP 192.168.174.12:45913 > 13.107.137.11:https A / Raw
✅ Ether / IP / UDP / DNS Qry b'mobile.events.data.microsoft.com.'
✅ Ether / IP / UDP / DNS Qry b'mobile.events.data.microsoft.com.'
✅ Ether / Dot1Q / IP / TCP 13.107.137.11:https > 192.168.174.12:45911 A
✅ Ether / IP / TCP 23.61.112.44:https > 192.168.174.12:46058 R
✅ Ether / IP / TCP 192.168.174.12:45911 > 13.107.137.11:https A / Raw
✅ Ether / IP / UDP / DNS Ans b'mobile.events.data.trafficmanager.net.'
✅ Ether / IP / UDP / DNS Ans b'mobile.events.data.trafficmanager.net.'
✅ Ether / IP / UDP / DNS Qry b'mobile.events.data.microsoft.com.'
✅ Ether / IP / TCP 192.168.174.12:46139 > 52.182.143.211:https S
✅ Ether / IP / TCP 192.168.174.12:46140 > 52.182.143.211:https S
✅ Ether / IP / UDP / DNS Ans b'mobile.events.data.trafficmanager.net.'
✅ Ether / IP / TCP 192.168.174.12:46141 > 52.182.143.211:https S
✅ Ether / IPv6 / TCP 2401:4900:63fe:9227:f1bd:8a0f:97da:c687:45904 > 2600:140f:6::17c7:4580:https PA / Raw
❌ Ether / IP / ICMP 192.168.174.12 > 202.39.224.7 echo-request 0 / Raw - Blocked Protocol: ICMP
✅ Ether / Dot1Q / IP / TCP 13.107.137.11:https > 192.168.174.12:45911 A
✅ Ether / Dot1Q / IP / TCP 13.107.137.11:https > 192.168.174.12:45911 A
✅ Ether / Dot1Q / IP / TCP 13.107.137.11:https > 192.168.174.12:45911 A
✅ Ether / Dot1Q / IP / TCP 13.107.137.11:https > 192.168.174.12:45911 A
✅ Ether / IP / TCP 23.61.112.44:https > 192.168.174.12:46107 A / Raw
✅ Ether / IP / TCP 23.61.112.44:https > 192.168.174.12:46123 SA
✅ Ether / IP / TCP 23.61.112.44:https > 192.168.174.12:46058 R
✅ Ether / IP / TCP 192.168.174.12:45911 > 13.107.137.11:https A / Raw
✅ Ether / IP / TCP 192.168.174.12:45911 > 13.107.137.11:https A / Raw
✅ Ether / IP / TCP 192.168.174.12:45911 > 13.107.137.11:https A / Raw
✅ Ether / IP / TCP 192.168.174.12:45911 > 13.107.137.11:https A / Raw
✅ Ether / IP / TCP 192.168.174.12:45911 > 13.107.137.11:https A / Raw
✅ Ether / IP / TCP 192.168.174.12:45911 > 13.107.137.11:https A / Raw
✅ Ether / IP / TCP 23.61.112.44:https > 192.168.174.12:46061 R
✅ Ether / Dot1Q / IP / TCP 13.107.137.11:https > 192.168.174.12:45911 A
✅ Ether / Dot1Q / IPv6 / TCP 2600:1900:4110:86f:::http > 2401:4900:63fe:9227:f1bd:8a0f:97da:c687:45908 A
✅ Ether / IP / TCP 23.61.112.44:https > 192.168.174.12:46138 A
✅ Ether / Dot1Q / IP / TCP 13.107.137.11:https > 192.168.174.12:45911 A
✅ Ether / IP / TCP 192.168.174.12:45911 > 13.107.137.11:https A / Raw
✅ Ether / IP / TCP 192.168.174.12:45911 > 13.107.137.11:https A / Raw
✅ Ether / IP / UDP / DNS Ans b'cp601.prod.do.dsp.mp.microsoft.com.edgekey.net.'
✅ Ether / IP / TCP 23.61.112.44:https > 192.168.174.12:46049 R
✅ Ether / IP / UDP / DNS Ans b'cp601.prod.do.dsp.mp.microsoft.com.edgekey.net.'
✅ Ether / IP / TCP 192.168.174.12:45911 > 13.107.137.11:https A / Raw
✅ Ether / IP / TCP 23.61.112.44:https > 192.168.174.12:46052 A
✅ Ether / IP / TCP 23.61.112.44:https > 192.168.174.12:46054 R
✅ Ether / Dot1Q / IP / TCP 13.107.137.11:https > 192.168.174.12:45913 A
✅ Ether / IP / TCP 23.61.112.44:https > 192.168.174.12:46051 A
✅ Ether / IP / UDP / DNS Ans b'mobile.events.data.trafficmanager.net.'
✅ Ether / IP / UDP / DNS Ans b'mobile.events.data.trafficmanager.net.'
✅ Ether / IP / UDP / DNS Ans b'mobile.events.data.trafficmanager.net.'
✅ Ether / IP / TCP 192.168.174.12:45913 > 13.107.137.11:https A / Raw
✅ Ether / IP / TCP 192.168.174.12:45913 > 13.107.137.11:https A / Raw
✅ Ether / IPv6 / ICMPv6ND_NS / ICMPv6 Neighbor Discovery Option - Source Link-Layer Address 8a:4c:f4:58:74:a6
✅ Ether / IPv6 / ICMPv6ND_NA / ICMPv6 Neighbor Discovery Option - Destination Link-Layer Address f8:fe:5e:f6:07:bb
✅ Ether / Dot1Q / IP / TCP 13.107.137.11:https > 192.168.174.12:45913 A
✅ Ether / Dot1Q / IP / TCP 13.107.137.11:https > 192.168.174.12:45913 A
✅ Ether / IP / TCP 192.168.174.12:45913 > 13.107.137.11:https A / Raw
✅ Ether / IP / TCP 192.168.174.12:45913 > 13.107.137.11:https A / Raw
✅ Ether / IP / TCP 192.168.174.12:45913 > 13.107.137.11:https A / Raw
✅ Ether / IP / TCP 23.61.112.44:https > 192.168.174.12:46061 R
✅ Ether / IP / TCP 23.61.112.44:https > 192.168.174.12:46053 R
✅ Ether / IP / TCP 23.61.112.44:https > 192.168.174.12:46056 R
✅ Ether / IP / TCP 23.61.112.44:https > 192.168.174.12:46137 A / Raw
✅ Ether / IP / TCP 192.168.174.12:46137 > 23.61.112.44:https A
✅ Ether / IP / TCP 23.61.112.44:https > 192.168.174.12:46059 R
✅ Ether / IP / TCP 23.61.112.44:https > 192.168.174.12:46057 R
✅ Ether / IP / TCP 23.61.112.44:https > 192.168.174.12:46060 R
✅ Ether / Dot1Q / IP / TCP 13.107.137.11:https > 192.168.174.12:45913 A
✅ Ether / IP / TCP 192.168.174.12:45913 > 13.107.137.11:https A / Raw
✅ Ether / Dot1Q / IP / TCP 13.107.137.11:https > 192.168.174.12:45913 A
✅ Ether / Dot1Q / IP / TCP 13.107.137.11:https > 192.168.174.12:45913 A
✅ Ether / IP / TCP 192.168.174.12:45913 > 13.107.137.11:https A / Raw
✅ Ether / IP / TCP 192.168.174.12:45913 > 13.107.137.11:https A / Raw
✅ Ether / IP / TCP 192.168.174.12:45913 > 13.107.137.11:https A / Raw
✅ Ether / IPv6 / TCP 2401:4900:63fe:9227:f1bd:8a0f:97da:c687:45907 > 2600:140f:6::17c7:4580:https PA / Raw
✅ Ether / IP / TCP 23.61.112.44:https > 192.168.174.12:46055 R
✅ Ether / Dot1Q / IP / TCP 104.18.32.47:https > 192.168.174.12:45880 A
✅ Ether / Dot1Q / IP / TCP 104.18.32.47:https > 192.168.174.12:45880 A
✅ Ether / Dot1Q / IP / TCP 104.18.32.47:https > 192.168.174.12:45880 PA / Raw
✅ Ether / IP / TCP 192.168.174.12:45880 > 104.18.32.47:https FPA / Raw
✅ Ether / IP / TCP 192.168.174.12:45880 > 104.18.32.47:https RA
✅ Ether / IP / UDP / DNS Ans 2606:4700:90d2:7cbc:c276:6:5ff2:75c4
✅ Ether / Dot1Q / IP / TCP 104.18.32.47:https > 192.168.174.12:45880 A
✅ Ether / Dot1Q / IP / TCP 13.107.137.11:https > 192.168.174.12:45913 A
✅ Ether / Dot1Q / IP / TCP 104.18.32.47:https > 192.168.174.12:45880 PA / Raw
✅ Ether / Dot1Q / IP / TCP 104.18.32.47:https > 192.168.174.12:45880 PA / Raw
✅ Ether / Dot1Q / IP / TCP 104.18.32.47:https > 192.168.174.12:45880 PA / Raw
✅ Ether / Dot1Q / IP / TCP 104.18.32.47:https > 192.168.174.12:45880 A
✅ Ether / IP / TCP 192.168.174.12:45913 > 13.107.137.11:https A / Raw
✅ Ether / IP / TCP 192.168.174.12:45913 > 13.107.137.11:https A / Raw
✅ Ether / IP / UDP / DNS Ans
✅ Ether / Dot1Q / IPv6 / TCP 2600:140f:6::17c7:4580:https > 2401:4900:63fe:9227:f1bd:8a0f:97da:c687:45904 A
✅ Ether / Dot1Q / IP / TCP 13.107.137.11:https > 192.168.174.12:45913 A
✅ Ether / IP / TCP 192.168.174.12:45913 > 13.107.137.11:https A / Raw
✅ Ether / IP / UDP / DNS Qry b'mobile.events.data.microsoft.com.'
✅ Ether / IP / UDP / DNS Qry b'mobile.events.data.microsoft.com.'
✅ Ether / IP / UDP / DNS Qry b'mobile.events.data.microsoft.com.'
✅ Ether / IP / UDP / DNS Ans b'mobile.events.data.trafficmanager.net.'
✅ Ether / IP / TCP 23.61.112.44:https > 192.168.174.12:46125 SA
✅ Ether / IP / TCP 23.61.112.44:https > 192.168.174.12:46130 A
✅ Ether / IP / TCP 23.61.112.44:https > 192.168.174.12:46127 SA
✅ Ether / IP / TCP 23.61.112.44:https > 192.168.174.12:46128 SA
✅ Ether / IP / TCP 23.61.112.44:https > 192.168.174.12:46135 SA
✅ Ether / Dot1Q / IP / TCP 13.107.137.11:https > 192.168.174.12:45913 A
✅ Ether / IP / TCP 23.61.112.44:https > 192.168.174.12:46133 A
✅ Ether / IP / TCP 23.61.112.44:https > 192.168.174.12:46126 A
✅ Ether / IP / TCP 23.61.112.44:https > 192.168.174.12:46129 SA
✅ Ether / IP / TCP 23.61.112.44:https > 192.168.174.12:46124 SA
✅ Ether / IP / TCP 192.168.174.12:46125 > 23.61.112.44:https A
✅ Ether / IP / TCP 192.168.174.12:46127 > 23.61.112.44:https A
✅ Ether / IP / TCP 192.168.174.12:46128 > 23.61.112.44:https A
✅ Ether / IP / TCP 192.168.174.12:46135 > 23.61.112.44:https A
✅ Ether / IP / TCP 192.168.174.12:46129 > 23.61.112.44:https A
✅ Ether / IP / TCP 192.168.174.12:46124 > 23.61.112.44:https A
✅ Ether / IP / TCP 192.168.174.12:45913 > 13.107.137.11:https A / Raw
✅ Ether / IP / TCP 192.168.174.12:45913 > 13.107.137.11:https A / Raw
✅ Ether / IP / TCP 23.61.112.44:https > 192.168.174.12:46131 SA
✅ Ether / IP / TCP 192.168.174.12:46131 > 23.61.112.44:https A
✅ Ether / IP / TCP 23.61.112.44:https > 192.168.174.12:46132 SA
✅ Ether / IP / TCP 23.61.112.44:https > 192.168.174.12:46136 SA
✅ Ether / IP / TCP 23.61.112.44:https > 192.168.174.12:46137 A
✅ Ether / IP / TCP 192.168.174.12:46132 > 23.61.112.44:https A
✅ Ether / IP / TCP 192.168.174.12:46136 > 23.61.112.44:https A
✅ Ether / IP / TCP 23.61.112.44:https > 192.168.174.12:46134 SA
✅ Ether / Dot1Q / IP / TCP 13.107.137.11:https > 192.168.174.12:45957 A
✅ Ether / IP / TCP 192.168.174.12:46137 > 23.61.112.44:https A
✅ Ether / IP / TCP 192.168.174.12:46134 > 23.61.112.44:https A
✅ Ether / IP / TCP 192.168.174.12:45957 > 13.107.137.11:https A / Raw
✅ Ether / IPv6 / TCP 2401:4900:63fe:9227:f1bd:8a0f:97da:c687:45908 > 2600:1900:4110:86f:::http PA / Raw
✅ Ether / Dot1Q / IP / TCP 104.18.32.47:https > 192.168.174.12:45900 A
✅ Ether / IP / TCP 23.61.112.44:https > 192.168.174.12:46052 FPA / Raw
✅ Ether / Dot1Q / IP / TCP 13.107.137.11:https > 192.168.174.12:45913 A
✅ Ether / Dot1Q / IPv6 / TCP 2600:140f:6::17c7:4580:https > 2401:4900:63fe:9227:f1bd:8a0f:97da:c687:45907 A
✅ Ether / IP / TCP 192.168.174.12:45913 > 13.107.137.11:https A / Raw
✅ Ether / IP / TCP 192.168.174.12:46139 > 52.182.143.211:https S
✅ Ether / IP / TCP 192.168.174.12:46140 > 52.182.143.211:https S
✅ Ether / Dot1Q / IP / TCP 13.107.137.11:https > 192.168.174.12:45913 A
✅ Ether / IP / TCP 192.168.174.12:45913 > 13.107.137.11:https A / Raw
✅ Ether / IP / TCP 192.168.174.12:45913 > 13.107.137.11:https A / Raw
✅ Ether / IP / TCP 192.168.174.12:46141 > 52.182.143.211:https S
✅ Ether / Dot1Q / IP / TCP 13.107.137.11:https > 192.168.174.12:45913 A
✅ Ether / IP / TCP 192.168.174.12:45913 > 13.107.137.11:https A / Raw
✅ Ether / Dot1Q / IPv6 / TCP 2600:140f:6::17c7:4580:https > 2401:4900:63fe:9227:f1bd:8a0f:97da:c687:45905 A
✅ Ether / Dot1Q / IP / TCP 104.18.32.47:https > 192.168.174.12:45880 PA / Raw
✅ Ether / Dot1Q / IP / TCP 13.107.137.11:https > 192.168.174.12:45911 A
✅ Ether / IP / TCP 192.168.174.12:45911 > 13.107.137.11:https A / Raw
✅ Ether / IP / TCP 192.168.174.12:45911 > 13.107.137.11:https A / Raw
✅ Ether / Dot1Q / IP / TCP 13.107.137.11:https > 192.168.174.12:45911 A
✅ Ether / IP / TCP 192.168.174.12:45911 > 13.107.137.11:https A / Raw
✅ Ether / Dot1Q / IP / TCP 13.107.137.11:https > 192.168.174.12:45911 A
✅ Ether / Dot1Q / IPv6 / TCP 2600:140f:6::17c7:4580:https > 2401:4900:63fe:9227:f1bd:8a0f:97da:c687:45906 A
✅ Ether / IP / TCP 23.61.112.44:https > 192.168.174.12:46123 SA
✅ Ether / IP / TCP 192.168.174.12:45911 > 13.107.137.11:https A / Raw
✅ Ether / IP / TCP 192.168.174.12:45911 > 13.107.137.11:https A / Raw
✅ Ether / Dot1Q / IP / TCP 13.107.137.11:https > 192.168.174.12:45957 A
✅ Ether / IP / TCP 23.61.112.44:https > 192.168.174.12:46103 A
✅ Ether / IP / TCP 23.61.112.44:https > 192.168.174.12:46106 A
✅ Ether / IP / TCP 23.61.112.44:https > 192.168.174.12:46099 A
✅ Ether / IP / TCP 23.61.112.44:https > 192.168.174.12:46096 A
✅ Ether / IP / TCP 23.61.112.44:https > 192.168.174.12:46100 A
✅ Ether / IP / TCP 23.61.112.44:https > 192.168.174.12:46105 SA
✅ Ether / IP / TCP 23.61.112.44:https > 192.168.174.12:46102 A
✅ Ether / IP / TCP 23.61.112.44:https > 192.168.174.12:46098 A
✅ Ether / IP / TCP 23.61.112.44:https > 192.168.174.12:46095 SA
✅ Ether / IP / TCP 192.168.174.12:45957 > 13.107.137.11:https A / Raw
✅ Ether / IP / TCP 23.61.112.44:https > 192.168.174.12:46117 A
✅ Ether / IP / TCP 23.61.112.44:https > 192.168.174.12:46110 SA
✅ Ether / IP / TCP 23.61.112.44:https > 192.168.174.12:46109 A
✅ Ether / IP / TCP 23.61.112.44:https > 192.168.174.12:46107 A
✅ Ether / IP / TCP 23.61.112.44:https > 192.168.174.12:46120 A
✅ Ether / IP / TCP 23.61.112.44:https > 192.168.174.12:46108 SA
✅ Ether / IP / TCP 23.61.112.44:https > 192.168.174.12:46119 SA
✅ Ether / IP / TCP 23.61.112.44:https > 192.168.174.12:46111 A
✅ Ether / IP / TCP 23.61.112.44:https > 192.168.174.12:46104 A
✅ Ether / IP / TCP 23.61.112.44:https > 192.168.174.12:46114 A
✅ Ether / IP / TCP 23.61.112.44:https > 192.168.174.12:46118 A
✅ Ether / IP / TCP 23.61.112.44:https > 192.168.174.12:46097 A
✅ Ether / IP / TCP 23.61.112.44:https > 192.168.174.12:46112 A
✅ Ether / IP / TCP 23.61.112.44:https > 192.168.174.12:46116 SA
✅ Ether / IP / TCP 23.61.112.44:https > 192.168.174.12:46101 SA
✅ Ether / IP / TCP 23.61.112.44:https > 192.168.174.12:46115 SA
✅ Ether / IP / TCP 23.61.112.44:https > 192.168.174.12:46113 A
✅ Ether / IP / TCP 23.61.112.44:https > 192.168.174.12:46126 SA
✅ Ether / IP / UDP / DNS Qry b'ab.chatgpt.com.'
✅ Ether / IP / TCP 192.168.174.12:46126 > 23.61.112.44:https A
✅ Ether / IP / UDP / DNS Ans 104.18.32.47
✅ Ether / Dot1Q / IP / TCP 13.107.137.11:https > 192.168.174.12:45957 A
✅ Ether / IP / TCP 23.61.112.44:https > 192.168.174.12:46121 SA
✅ Ether / IP / TCP 192.168.174.12:45957 > 13.107.137.11:https A / Raw
✅ Ether / IP / TCP 192.168.174.12:45957 > 13.107.137.11:https A / Raw
✅ Ether / IP / UDP / DNS Qry b'cp601.prod.do.dsp.mp.microsoft.com.'
✅ Ether / IP / UDP / DNS Qry b'cp601.prod.do.dsp.mp.microsoft.com.'
✅ Ether / Dot1Q / IPv6 / TCP 2600:140f:6::17c7:4580:https > 2401:4900:63fe:9227:f1bd:8a0f:97da:c687:45905 A
✅ Ether / IP / TCP 52.168.112.66:https > 192.168.174.12:46042 A
✅ Ether / Dot1Q / IPv6 / TCP 2600:140f:6::17c7:4580:https > 2401:4900:63fe:9227:f1bd:8a0f:97da:c687:45905 A / Raw
✅ Ether / Dot1Q / IPv6 / TCP 2600:140f:6::17c7:4580:https > 2401:4900:63fe:9227:f1bd:8a0f:97da:c687:45905 PA / Raw
